{
  "schema_version": "diptrace-fixture-manifest-pending-v1",
  "status": "synthetic_mcp_generated_parser_fixture",
  "provenance": "mcp_generated",
  "validation_level": "synthetic_operation_fixture",
  "diptrace_opened": false,
  "diptrace_saved": false,
  "diptrace_reexported": false,
  "roundtrip_verified": false,
  "diptrace": {
    "target_version": "5.3.0.2",
    "version_used_for_final_exports": null,
    "build": null,
    "operating_system": "Not applicable — MCP-generated synthetic fixture"
  },
  "redistribution": {
    "permitted": true,
    "basis": "The design is wholly synthetic and was authored specifically for this open-source repository; it contains no third-party project data."
  },
  "artifacts": [
    {
      "path": "source_board.xml",
      "status": "synthetic_mcp_generated",
      "source_type": "DipTrace-PCB",
      "validation_level": "synthetic_operation_fixture",
      "provenance": "mcp_generated",
      "format_version": "4.3.0.3",
      "sha256": "e3acbc68fcb7374b4f7fd8c536679e57ebac62435ab41e696e65b6f1f256ada6",
      "intended_semantic_difference": "Baseline synthetic four-layer board for parser and routing operation tests. NOT validated by DipTrace open/save."
    },
    {
      "path": "specctra/source_board.xml",
      "status": "synthetic_frozen_copy",
      "source_type": "DipTrace-PCB",
      "validation_level": "synthetic_parser_only",
      "provenance": "mcp_generated",
      "format_version": "4.3.0.3",
      "sha256": "e3acbc68fcb7374b4f7fd8c536679e57ebac62435ab41e696e65b6f1f256ada6",
      "intended_semantic_difference": "Frozen source revision from which input.dsn must be exported. NOT DipTrace-validated."
    }
  ],
  "known_limitations": [
    "This is a synthetic MCP-generated fixture, NOT a DipTrace-exported fixture.",
    "It has never been opened, saved, or re-exported by DipTrace.",
    "It must NOT be used as evidence of DipTrace 5.3 compatibility.",
    "No promotion path exists for this fixture.",
    "The fixture validates MCP parser, routing compiler, and semantic operations only.",
    "A real acceptance fixture must start from a genuine DipTrace-exported seed."
  ]
}
